{
  "$schema": "https://json-schema.org/draft/2020-12/schema",
  "$id": "https://example.invalid/schemas/artifact_envelope.schema.json",
  "title": "ArtifactEnvelope",
  "description": "Wrapper shared by every records-bearing public artifact (docs/DECISIONS.md ADR-020). The envelope carries the schema version outside the records so a frontend can reject an unsupported major version before parsing any record, as docs/DATA_CONTRACTS.md section 13 requires. Records are validated separately against their own record schema.",
  "type": "object",
  "additionalProperties": false,
  "required": [
    "schema_version",
    "artifact",
    "build_id",
    "generated_at_utc",
    "record_count",
    "records"
  ],
  "properties": {
    "schema_version": {
      "const": "1.0"
    },
    "artifact": {
      "enum": [
        "tiers",
        "arbitrage",
        "market_trend_series",
        "projections",
        "market_snapshot",
        "player_status",
        "ros_tiers",
        "inseason_opportunity",
        "player_headshots",
        "behavior_trend_series",
        "player_usage",
        "team_matchups",
        "weekly_projections",
        "weekly_context",
        "season_actuals",
        "player_skill_tree",
        "skill_tree_definitions",
        "espn_ownership",
        "espn_ownership_series",
        "recent_form"
      ]
    },
    "record_schema": {
      "type": "string",
      "minLength": 1
    },
    "build_id": {
      "type": "string",
      "minLength": 1
    },
    "generated_at_utc": {
      "type": "string",
      "format": "date-time"
    },
    "record_count": {
      "type": "integer",
      "minimum": 0
    },
    "arbitrage_mode": {
      "enum": [
        "baseline",
        "ml"
      ]
    },
    "records": {
      "type": "array",
      "items": {
        "type": "object"
      }
    }
  }
}
