{
  "schema_version": "1.0",
  "artifact": "market_snapshot",
  "record_schema": "market_snapshot",
  "build_id": "fixture-20260818T120000Z",
  "generated_at_utc": "2026-08-18T12:00:00Z",
  "record_count": 14,
  "records": [
    {
      "schema_version": "1.0",
      "source_id": "myfantasyleague_adp",
      "snapshot_at_utc": "2026-08-18T12:00:00Z",
      "source_as_of_utc": null,
      "season": 2026,
      "league_size": 12,
      "scoring_preset": "PPR",
      "player_id": "gsis:00-0000002",
      "market_adp": 2.4,
      "market_rank": 1,
      "sample_size": 140,
      "adp_sd": null,
      "adp_low": 1.0,
      "adp_high": 6.0,
      "source_format_detail": "no filters (approximate cohort)",
      "quality_flags": [
        "cohort_approximate",
        "adp_sd_unavailable",
        "source_as_of_unavailable"
      ]
    },
    {
      "schema_version": "1.0",
      "source_id": "myfantasyleague_adp",
      "snapshot_at_utc": "2026-08-18T12:00:00Z",
      "source_as_of_utc": null,
      "season": 2026,
      "league_size": 12,
      "scoring_preset": "PPR",
      "player_id": "gsis:00-0000004",
      "market_adp": 8.7,
      "market_rank": 2,
      "sample_size": 138,
      "adp_sd": null,
      "adp_low": 3.0,
      "adp_high": 18.0,
      "source_format_detail": "no filters (approximate cohort)",
      "quality_flags": [
        "cohort_approximate",
        "adp_sd_unavailable",
        "source_as_of_unavailable"
      ]
    },
    {
      "schema_version": "1.0",
      "source_id": "myfantasyleague_adp",
      "snapshot_at_utc": "2026-08-18T12:00:00Z",
      "source_as_of_utc": null,
      "season": 2026,
      "league_size": 12,
      "scoring_preset": "PPR",
      "player_id": "gsis:00-0000006",
      "market_adp": 12.1,
      "market_rank": 3,
      "sample_size": 131,
      "adp_sd": null,
      "adp_low": 6.0,
      "adp_high": 25.0,
      "source_format_detail": "no filters (approximate cohort)",
      "quality_flags": [
        "cohort_approximate",
        "adp_sd_unavailable",
        "source_as_of_unavailable"
      ]
    },
    {
      "schema_version": "1.0",
      "source_id": "myfantasyleague_adp",
      "snapshot_at_utc": "2026-08-18T12:00:00Z",
      "source_as_of_utc": null,
      "season": 2026,
      "league_size": 12,
      "scoring_preset": "PPR",
      "player_id": "gsis:00-0000003",
      "market_adp": 21.9,
      "market_rank": 5,
      "sample_size": 120,
      "adp_sd": null,
      "adp_low": 12.0,
      "adp_high": 38.0,
      "source_format_detail": "no filters (approximate cohort)",
      "quality_flags": [
        "cohort_approximate",
        "adp_sd_unavailable",
        "source_as_of_unavailable"
      ]
    },
    {
      "schema_version": "1.0",
      "source_id": "myfantasyleague_adp",
      "snapshot_at_utc": "2026-08-18T12:00:00Z",
      "source_as_of_utc": null,
      "season": 2026,
      "league_size": 12,
      "scoring_preset": "PPR",
      "player_id": "gsis:00-0000007",
      "market_adp": 26.4,
      "market_rank": 6,
      "sample_size": 118,
      "adp_sd": null,
      "adp_low": 15.0,
      "adp_high": 44.0,
      "source_format_detail": "no filters (approximate cohort)",
      "quality_flags": [
        "cohort_approximate",
        "adp_sd_unavailable",
        "source_as_of_unavailable"
      ]
    },
    {
      "schema_version": "1.0",
      "source_id": "myfantasyleague_adp",
      "snapshot_at_utc": "2026-08-18T12:00:00Z",
      "source_as_of_utc": null,
      "season": 2026,
      "league_size": 12,
      "scoring_preset": "PPR",
      "player_id": "gsis:00-0000001",
      "market_adp": 33.8,
      "market_rank": 7,
      "sample_size": 115,
      "adp_sd": null,
      "adp_low": 20.0,
      "adp_high": 55.0,
      "source_format_detail": "no filters (approximate cohort)",
      "quality_flags": [
        "cohort_approximate",
        "adp_sd_unavailable",
        "source_as_of_unavailable"
      ]
    },
    {
      "schema_version": "1.0",
      "source_id": "myfantasyleague_adp",
      "snapshot_at_utc": "2026-08-18T12:00:00Z",
      "source_as_of_utc": null,
      "season": 2026,
      "league_size": 12,
      "scoring_preset": "PPR",
      "player_id": "gsis:00-0000009",
      "market_adp": 41.2,
      "market_rank": 8,
      "sample_size": 96,
      "adp_sd": null,
      "adp_low": 26.0,
      "adp_high": 67.0,
      "source_format_detail": "no filters (approximate cohort)",
      "quality_flags": [
        "cohort_approximate",
        "adp_sd_unavailable",
        "source_as_of_unavailable"
      ]
    },
    {
      "schema_version": "1.0",
      "source_id": "myfantasyleague_adp",
      "snapshot_at_utc": "2026-08-18T12:00:00Z",
      "source_as_of_utc": null,
      "season": 2026,
      "league_size": 12,
      "scoring_preset": "PPR",
      "player_id": "gsis:00-0000005",
      "market_adp": 49.6,
      "market_rank": 9,
      "sample_size": 88,
      "adp_sd": null,
      "adp_low": 31.0,
      "adp_high": 80.0,
      "source_format_detail": "no filters (approximate cohort)",
      "quality_flags": [
        "cohort_approximate",
        "adp_sd_unavailable",
        "source_as_of_unavailable"
      ]
    },
    {
      "schema_version": "1.0",
      "source_id": "myfantasyleague_adp",
      "snapshot_at_utc": "2026-08-18T12:00:00Z",
      "source_as_of_utc": null,
      "season": 2026,
      "league_size": 12,
      "scoring_preset": "PPR",
      "player_id": "gsis:00-0000010",
      "market_adp": 58.3,
      "market_rank": 10,
      "sample_size": 71,
      "adp_sd": null,
      "adp_low": 38.0,
      "adp_high": 92.0,
      "source_format_detail": "no filters (approximate cohort)",
      "quality_flags": [
        "cohort_approximate",
        "adp_sd_unavailable",
        "source_as_of_unavailable"
      ]
    },
    {
      "schema_version": "1.0",
      "source_id": "myfantasyleague_adp",
      "snapshot_at_utc": "2026-08-18T12:00:00Z",
      "source_as_of_utc": null,
      "season": 2026,
      "league_size": 12,
      "scoring_preset": "PPR",
      "player_id": "gsis:00-0000008",
      "market_adp": 72.5,
      "market_rank": 11,
      "sample_size": 52,
      "adp_sd": null,
      "adp_low": 47.0,
      "adp_high": 110.0,
      "source_format_detail": "no filters (approximate cohort)",
      "quality_flags": [
        "cohort_approximate",
        "adp_sd_unavailable",
        "source_as_of_unavailable"
      ]
    },
    {
      "schema_version": "1.0",
      "source_id": "myfantasyleague_adp",
      "snapshot_at_utc": "2026-08-18T12:00:00Z",
      "source_as_of_utc": null,
      "season": 2026,
      "league_size": 12,
      "scoring_preset": "PPR",
      "player_id": "gsis:00-0000016",
      "market_adp": 95.0,
      "market_rank": 12,
      "sample_size": 33,
      "adp_sd": null,
      "adp_low": 60.0,
      "adp_high": 140.0,
      "source_format_detail": "no filters (approximate cohort)",
      "quality_flags": [
        "cohort_approximate",
        "adp_sd_unavailable",
        "source_as_of_unavailable"
      ]
    },
    {
      "schema_version": "1.0",
      "source_id": "myfantasyleague_adp",
      "snapshot_at_utc": "2026-08-18T12:00:00Z",
      "source_as_of_utc": null,
      "season": 2026,
      "league_size": 12,
      "scoring_preset": "PPR",
      "player_id": "gsis:00-0000014",
      "market_adp": 104.2,
      "market_rank": 13,
      "sample_size": 27,
      "adp_sd": null,
      "adp_low": 70.0,
      "adp_high": 150.0,
      "source_format_detail": "no filters (approximate cohort)",
      "quality_flags": [
        "cohort_approximate",
        "adp_sd_unavailable",
        "source_as_of_unavailable"
      ]
    },
    {
      "schema_version": "1.0",
      "source_id": "myfantasyleague_adp",
      "snapshot_at_utc": "2026-08-18T12:00:00Z",
      "source_as_of_utc": null,
      "season": 2026,
      "league_size": 12,
      "scoring_preset": "PPR",
      "player_id": "gsis:00-0000011",
      "market_adp": 132.7,
      "market_rank": 14,
      "sample_size": 18,
      "adp_sd": null,
      "adp_low": 90.0,
      "adp_high": 180.0,
      "source_format_detail": "no filters (approximate cohort)",
      "quality_flags": [
        "cohort_approximate",
        "adp_sd_unavailable",
        "source_as_of_unavailable"
      ]
    },
    {
      "schema_version": "1.0",
      "source_id": "myfantasyleague_adp",
      "snapshot_at_utc": "2026-08-18T12:00:00Z",
      "source_as_of_utc": null,
      "season": 2026,
      "league_size": 12,
      "scoring_preset": "PPR",
      "player_id": "gsis:00-0000012",
      "market_adp": 218.4,
      "market_rank": 18,
      "sample_size": 6,
      "adp_sd": null,
      "adp_low": 170.0,
      "adp_high": 250.0,
      "source_format_detail": "no filters (approximate cohort)",
      "quality_flags": [
        "cohort_approximate",
        "adp_sd_unavailable",
        "source_as_of_unavailable"
      ]
    }
  ]
}
